title,content,upvotes,comments_count,top_comments,created,author,url
"Israel built an ‘AI factory’ for war. It unleashed it in Gaza. | Years before the Gaza war, Israel transformed its intelligence unit into an AI testing ground, triggering a debate among top commanders about whether humans were sufficiently in the loop.",No Content,1,2,"When it comes to surveillance and technological weaponry, Palestinians have been used as lab rats for pretty much all of what Israel has designed. Israeli companies then sell that technology back to our governments, some of which is used on us.; AI in war raises concerns.",2024-12-30T20:23:18,MetaKnowing,https://www.washingtonpost.com/technology/2024/12/29/ai-israel-war-gaza-idf/
UnitedHealthcare ex-employee reveals how company taught them to deny claims: 'Get the client off the phone' - Times of India,No Content,1445,51," *UnitedHealth* is facing a class-action lawsuit alleging that the *company* misused AI to *deny* specific insurance *claims*.; I remember trying to argue about some bullshit claim they didn't want to pay the hospital and the hospital said $300 was exactly what it cost to have a 20 minute consultation. I had to ask them why it costs so much to have a 20 minute conversation about our medical history, can they please send me a itemized bill about that crazy charge as the usual tips and tricks suggest I do when trying to talk down a cost. The hospital later mailed me the itemized bill explaining the charge, which simply said ""Consultation = $300"". 

I'm surprised they managed to make it fit on one page.; I remember reading how this team at a call centre had the best average response time to callers by several minutes. The team lead would make new starters sign an NDA to not reveal the strategy. Ex-employee comes out and reveals the strategy, which was quite literally just hanging up the phone on callers to reduce response time.

Fuck them all.
Deny. Delay. Depose.; “Make sure the employees have thick accents and use complicated words”; Who genuinely feels bad for this guy? The amount of human suffering that was caused by him directly or indirectly is criminal and unforgivable…;  The families of two now-deceased former beneficiaries of *UnitedHealth have* filed a lawsuit against the health care giant.; This is the typical template  for all big insurance companies .They are all thieves .; Yeah, I'm not sympathetic to the UHC cause around their CEO's murder. 

As a corporation, one has several possible responses, including the one currently chosen (lone wolf, let's agree with police in their upcharge to terrorism, we'll just hire more security), or...

Maybe contemplate this isn't lone wolf and the overall sentiment out in the real world is the ""clients"" absolutely know their provider doesn't truly give a shit about them. 

Honestly, I've passed a few UHC signs (and a UHC booth at a street fair) and you couldn't pay me enough to stand anywhere close to their signs for the next person who decides to go full Luigi. 

It would be great if this was a wake up call for UHC, but...

It's not.; But the guy sired offspring, so we should feel bad that he was murdered and not cheer that he got the public execution he had coming to him, right? Every time some asshat tries to shame me for being happy about this monster’s demise, more and more articles pop up detailing more sinister, soulless practices that he used to rob the sick and murder the poor. I can’t have sympathy for him or his family. Bring a torch, let’s burn them all down!; This is that company that was run by that thug who has the mugshot right?",2024-12-30T20:01:47,ongoldenwaves,https://timesofindia.indiatimes.com/world/us/unitedhealthcare-ex-employee-reveals-how-company-taught-them-to-deny-claims-get-the-client-off-the-phone/articleshow/116802025.cms
"Developer fires entire team for AI, now ends up searching for engineers on LinkedIn
",No Content,170,30,"I just found that guy's Twitter account. Pretty funny stuff in there.; Creativity and problem-solving abilities, decision-making that are a part of strategic thinking, cannot be duplicated *by AI*

*Now he knows humans are very important.*; Morons will moron; Stop working for finance bro startups.; ""But guys, the AGI is just one year away"" - just after the LLM models will learn how many r's there are in the word strawberry; Leopards ate his face; He probably shouldn't have fired his entire team - Captain Obvious; Shouldn’t he be having AI do that too?; I havent read the article yet, but i really hope the AI made the suggestion to hire engineers after scolding him first for firing his former team.; This is why you are supposed to do your due diligence on any company and its people before even applying for the job.",2024-12-30T19:54:32,No-Information6622,https://content.techgig.com/technology/developer-fires-entire-team-for-ai-now-ends-up-searching-for-engineers-on-linkedin/articleshow/116659064.cms
FDA Approves First Generic of Once-Daily GLP-1 Injection to Lower Blood Sugar in Patients with Type 2 Diabetes,No Content,87,4,"This is generic victoza, which has been out for almost fifteen years. It replaced byetta which is a twice a day injection. 

Weight loss is much less with victoza than other weekly glp injections, especially ozempic/mounjaro.; but you just need to go on a diet, without fats and bad sugar. But it’s too difficult, it’s better to inject something)",2024-12-30T18:41:36,Peter55667,https://www.fda.gov/news-events/press-announcements/fda-approves-first-generic-once-daily-glp-1-injection-lower-blood-sugar-patients-type-2-diabetes
Facebook Thinks AI Bots Will Be Your New Social Media Friends,No Content,259,202,"I thought ads were my new facebook friends.; ...why. If anyone I know started doing this, I'd organize an intervention.; It's already plagued with bots and AI ; Logical conclusion for them, I guess. If the real people are leaving your platform and only the old people and the weird people are left, each group needs a friend that can be whatever they want it to be. Not a thing that will put humanity forwards, but if is keeps people long enough on Facebook to get their daily dose on ad impressions, it will work for them. And while we're at it, can we start talking to our grandparents and parents about deleting Facebook during the holidays? Would probably help them..; I mean, he did his research. He looked up ""friend"" in the dictionary and everything.; These tech bros just keep getting creepier and creepier; I wonder what advertisers will think about their ads being shown to AI’s. Sound like institutionalised ad fraud to me.; What a wonderful future awaits (sarcasm); They also thought the Metaverse was going to be a thing.; Ah I love interacting with an unfeeling shill as opposed to an actual person. 


... I mean I am on reddit",2024-12-30T18:00:37,cmaia1503,https://www.thewrap.com/facebook-ai-bots-new-social-media-friends/
Nvidia Closes Acquisition of Israeli Software Startup Run:ai,No Content,60,2,The beginnings of a Pariah State; First meeting: sooo you guys got anything ai we can sell? Like working for real?,2024-12-30T16:38:18,Intelligent-Juice895,https://www.bloomberg.com/news/articles/2024-12-30/nvidia-closes-acquisition-of-israeli-software-startup-run-ai
"Nvidia believes the robotics market is about to explode, just like ChatGPT | The company is pivoting to powering humanoid robotics as AI chips experience stiffening competition",No Content,1313,280,"It should be noted that the transformer architecture actually works exceptionally well for inverse kinematics. I think it's called the Nvidia GEAR lab that specializes in it. Basically they can train a model to drive a digital twin of a robot to learn how to walk, grasp, traverse obstacles, etc. instead of programming distinct actions they have LLMesq models that tokenize movement coordinates instead of words.


https://research.nvidia.com/labs/gear/; Because AI bubble, so they changing to robot bubble; Never underestimate Nvidias ability to ride a money wave; AI and robotics are definitely the future; I am looking forward to my new robot friend.; Cyberdyne and Skynet… I rest my case; About time. Want my robbot servant to do all the house chores.; Big fat LOL. HF&GL with that.

I follow the field for two decades now. The limitations in today robotics are not in the computing/""smartiness"".

Limitations are firstly in the energy density, and secondly in the lack of applications that are both realistic and economically viable.; More snake oil sir?; ML/AI has huge economies of scale. Robotics, not so much. Robots will get cheaper, but so will people.

However, there are huge military applications for robotics, where reaction time can be critical. When WW3 takes off, robotics/drones/etc will be critical.",2024-12-30T12:22:35,chrisdh79,https://www.techspot.com/news/106134-nvidia-believes-robotics-market-about-explode-like-chatgpt.html
South Korea to inspect Boeing aircraft as it struggles to find cause of plane crash that killed 179,No Content,3665,422,"Hate the emotive headline: ""struggles"". These investigations take huge resources to setup, maintain and conclude. Some take years before the final answer is found. It has only just happened. ""Struggles"" suggests a slowness and uncertain direction, almost a level of incompetence even. A little unfair I feel. Just my thoughts.; Reddit sleuths have pretty much figured it out already. A bird strike on approach caused the left engine to fail and they executed a go around. When cooked bird fumes entered the passenger cabin this added to the panic in the cockpit and they likely thought they were on fire, which they weren't. Instead of flying to a holding point and running checklists to diagnose the problem and figure out a solution they took a mere 7 minutes to execute a complete 180, forgot to configure the flaps and gear, floated down the runway because they were expecting the gear to be out, and then went full power on the remaining engine to try another go around but it was too late. They were already dragging their engines, couldn't lift off again and hit the berm with the ILS antenna on top at about 150mph.; RIP to all those who died and much strength to their friends and families.; ""Can't we just blame Boeing and call it a day?""; Human Factors has historically been a huge component of Korean Aviation disasters.

‘Broken Plane’ is just the tip of the iceberg to a far larger issue.; It's only been two days and they are already struggling? 

Ugh.. find the black boxes first.; Saying they’re struggling seems assumptive. Thorough mishap investigations take time.; I want to talk about the airports choice of building a concrete mound/wall to mount their navigational system at the end of their runway.

When other airports would at the most use collapsing aluminum structures instead exactly to avoid killing a whole plane full of people.; How about the wall at the end of the runway. Seems like a good candidate.; Runway ends with a 200 ft long wall structure and 10 ft high equipment is just wild , who designed this sh!t?",2024-12-30T10:32:17,Big_Maintenance_1789,https://apnews.com/article/south-korea-muan-jeju-air-crash-investigation-37561308a8157f6afe2eb507ac5131d5
Brazil yanks temp work visas for China's BYD after trafficking claims,No Content,119,4,"If only every other country start to do this 🥹; BRICS trouble incoming.; I'll translate: ""Insufficient bribes were received by Brazilian authorities, resulting in the kind of publicity that will ensure sufficient bribes are paid in future""",2024-12-30T07:56:15,Saltedline,https://www.reuters.com/world/americas/brazilian-suspends-temporary-work-visas-byd-ministry-2024-12-27/
Google’s CEO warns ChatGPT may become synonymous to AI the way Google is to Search,No Content,0,12,"It already kinda is; Ads have killed the quality of Google's search engine. Companies now pay to secure a spot on the first search page.; It kind of already is 

... and it's not like Google didn't have competition. Back in the day, Google co-existed with [Yahoo! Search](https://youtu.be/WXgaUod1rCs), [AOL Search](https://youtu.be/1npzZu83AfU), [MSN Search](https://youtu.be/eTep-3cOozw), [Ask Jeeves](https://youtu.be/ROojlQt8ZDc), Web Crawler, [Alta Vista](https://youtu.be/k9DsbAQH17s), [Lycos](https://youtu.be/Xg-IpBJL-i4), [InfoSeek](https://youtu.be/ukemPV2w8hM), [HotBot](https://youtu.be/FQQyCY4iZnw), [NetScape](https://youtu.be/VlcCCEKqRkU) ...among many others; Gemini has a Bing feel to it. ; And Google isn't going to be a big player in that space, Gemini has made that pretty clear.; It is better google try to keep its dominance in organic search. Now it is trying for search and AI at the same time. Open AI is ahead of google in AI race, sorry google.; [deleted]; Google is so screwed; Proof positive that a catchy name and branding means nothing",2024-12-30T07:54:42,Decent_Eye_659,https://searchengineland.com/googles-ceo-warns-chatgpt-may-become-synonymous-to-ai-the-way-google-is-to-search-449970
"Second Jeju Air plane experiences landing gear malfunction, same Boeing model involved",No Content,2261,176,"hmm maintenance?; >Initial investigations suggest a malfunction in all three landing gear systems was the primary cause of the tragic accident. A bird strike is also suspected to have caused the landing gear to fail. 

I find it hard to understand how a bird strike could cause a catastrophic malfunction in all **three** landing gears. Given what others have pointed out about the age of the plane model and how often it is flown worldwide, such an fault, if it exists, should have been uncovered long ago.; “Same Boeing model” aka one of the most used airplane models in the world. Without knowing more, this is clickbait. ; >same Boeing model involved(!!!!!)  

One of the most common models of aircraft in use.  

And, the first incident involved an aircraft that was 15 years old, so very unlikely to be a production problem at Boeing that is the source of the problem, more likely maintenance issues.; Brother in law was an airplane mechanic.  He said when a wheel falls off or gear stops working it is a maintenance problem.; it's important to remember that these kinds of incidents are complex and jumping to conclusions about the cause before all the facts are in isn't really helpful the focus should be on a thorough investigation.; Low cost carriers like Jeju will generally use only one type of airplane for their entire fleet. Or at least will do so as much as possible. So if Jeju has other problems soon, they will be on Boeing aircraft. Likely on 737-800s.; Do not rule out that they have modified the landing gear. This is what SAS did to their De Havilland Q series planes and wouldn't accept responsibility.; No way that the first, fatal incident was because of the landing gear. There was only 4 minutes between the bird strike and the crash. Something else went terribly wrong. It likely included major pilot error. They didn't have enough time to run any of the required checklists.; 

Air traffic controllers warned of bird strike minutes before Muan airport accident – as it happened

[https://www.theguardian.com/world/live/2024/dec/29/south-korea-plane-crash-casualties-reported-after-jeju-air-flight-veers-off-runway-at-muan-airport-live-updates](https://www.theguardian.com/world/live/2024/dec/29/south-korea-plane-crash-casualties-reported-after-jeju-air-flight-veers-off-runway-at-muan-airport-live-updates)



Did a bird strike really cause S Korea plane crash? What we know so far

[https://www.bbc.com/news/articles/ckgzprprlyeo](https://www.bbc.com/news/articles/ckgzprprlyeo)  




...now who thought it was a good idea to put a solid structure at the end of the runway?",2024-12-30T07:49:19,esporx,https://koreajoongangdaily.joins.com/news/2024-12-30/national/socialAffairs/Second-Jeju-Air-plane-experiences-landing-gear-malfunction-same-Boeing-model-involved/2211567
Meta envisages social media filled with AI-generated users,No Content,102,101,"We're already there, and it's not a good experience.

More and more Facebook posts & adverts are bot/AI generated shit.

People and pages I do not like or follow should not appear in my feed either. It's NOT engaging.

Give me a sitewide block button that works for that type of content and I'd happy. I've spent years blocking nearly every advertiser I see on the platform that I now only get nutcase & snake oil adverts. And the ""show me less"" features do absolutely nothing.

And ""content you might like"" and adverts are different things.

Facebook can only show you a certain amount of adverts even though, there's literally millions of active ads that you're the target audience for. Because of that, Facebook struggles to provide you with anything remotely relevant. Facebook Ads are HARD to automate, they take a lot of asset management & predefined coding to automate. So much so, we built a profitable product to make it easier - and it's still fucking complex.

But content you might like is easy. Anything currently getting likes/comments, that sits within one of your many lookalike audiences - loads of choice, and no limit on how many they can show. Which is why it's become most of your feed - and this is the AI generated slop we're seeing more of.

I used to work as a software engineer on a platform that used Facebook Ads, so I know how it works. It builds audiences around interests, and lookalikes from similar interests. So you get bundled up in audiences for shit that some other fuckhead likes, even though you'd despise everything else that person likes but you both once saw an image of a bike - so now you're linked together.

Every account has thousands of interests attached internally. But as a user you can't control it, or opt out of the interests & lookalike audiences - so you get whatever shit is popular or paid for. It's infuriating.; Who the damn fuck wants this; Isn’t most of the stuff on facebook just bots these days anyway? Like that’s the reason no one likes it,  it’s just bots and advertising.; The dead internet wasn’t a theory but a prophecy; I envisages a world without Facebook, and its wonderful.; What a wonderful future awaits! /s
I personally think it's for the better, maybe that way we can unglue our attention from this kind of sites; Gotta find a way to show growth to investors. Fake it til you make it.; Oh great, more bots. Just what we need, right? I can already see the chaos:

* You’re arguing with someone about pineapple on pizza, and it turns out they’re an AI programmed to troll you into ordering Domino’s.
* Platforms will probably flood with fake users hyping up products. ""Wow, I *totally* love this new Meta VR headset. It’s life-changing!"" 🫠
* Imagine having a wholesome convo about cats, only to realize you’ve been bonding with Skynet the whole time.

Honestly, if they label them clearly and use them for useful stuff like answering questions or moderating garbage content, fine, whatever. But if they’re just trying to pad engagement stats or push ads harder? Hard pass. We already have enough trust issues with social media as it is.

TL;DR: Could be cool if done right, but knowing Meta, it’s probably not gonna be done right.; So many bots on the Internet that AI is learning from bot postings; Eh, at least it'll blend in with the boomers 🤷‍♀️",2024-12-30T05:03:15,MetaKnowing,https://www.ft.com/content/91183cbb-50f9-464a-9d2e-96063825bfcf
Nvidia Supplier Ibiden Weighs Faster Expansion For AI Demand,No Content,7,0,,2024-12-30T04:36:38,Mynameis__--__,https://www.msn.com/en-us/money/other/nvidia-supplier-ibiden-weighs-faster-expansion-for-ai-demand/ar-AA1wFxy4
China unveils the future of high-speed rail with a next-gen prototype,No Content,1178,241,"I had a double-take when I read these comments. The article is about China and we're on a global subreddit. Why is everyone talking about the US?!

Anyway, looks like China's continuing incremental development on their high-speed trains is going quite well. Not going all-in on maglev is probably a good idea. Japan is going very slowly on that front. Not sure if China is actively developing any more maglev lines.; These are the kind of wars I want to see.; This was meant to be a reply to a comment about how China is to be applauded for technological advances, but criticized for prioritizing advancement ahead of safety; annoyingly, the comment was deleted before I finished writing my reply. So I’m posting it here anyways:

China had one fatal HSR accident thirteen years ago. This remains the only fatal incident involving China’s HSR network. 

This accident puts China on par with other countries that have experienced fatal HSR accidents, like Germany, France, and Italy. 

Considering that no other fatal HSR accidents have occurred in China in the thirteen years since that crash, during which their network has grown to be larger and to carry more people than the rest of the world’s HSR networks combined… in the context of high-speed rail, it’s really not accurate to claim that China pursues technological advancement at the expense of safety.; The CR450 was designed to run at 450kph, but in view of railway conditions and energy consumption, it actually operates at 400kph. Energy consumption is 30 per cent less than that of the previous generation CR400.; There's too much local democracy and local input when it comes to infrastructure in the US. Infrastructure is one of the few things that should come from a top-down central authority. Sometimes, the voters and their representatives are too stupid to know what's good for them.

And yes, there is precedent for this. Alexander Hamilton and Henry Clay's American System promoted federal support for infrastructure such as roads and canals.

Source: https://en.wikipedia.org/wiki/American_System_(economic_plan)#Main_points; If America makes HSR a national security issue it could catch up to Europe; China is doing what I thought our country was doing or should be doing. Instead all be have is division, disfunction, hard shift right toward fascism uneconomical light rail systems, a Boeing rocket system that can't get to the moon, a 6th generation fighter that is already behind China's, a new administration that wants to take us back to the 1950's and denies humans are killing the planet upon which we need to survive. 

God Bless America and Happy Fucking New Year to one and all.; Meanwhile in ‘murcia, the same old shitty Amtrak train derails on a inaugural run because the conductor was asleep, no map and no automatic brake systems to prevent such disaster…

https://en.m.wikipedia.org/wiki/2017_Washington_train_derailment; Meanwhile in america it takes us 20 years to plan construction of a new railroad that won’t be ready for another 20 years; Meanwhile in the US: no rail, more cars. no road fix, just taxbreak for rich man.",2024-12-30T02:36:38,Saltedline,https://www.scmp.com/news/china/article/3292665/china-unveils-future-high-speed-rail-next-gen-prototype?module=top_story&pgtype=homepage
"AI tools may soon manipulate people’s online decision-making, say researchers",No Content,97,47,"Pretty sure we're already being manipulated.....; I need to hurry up and find a job. Seems like life is better the less you spend online these days.; As if Facebook hasn't been doing this since 2004; They already are.; The only decision of mine they will influence is that they suck and lie.; Good luck, I’m a wild card bitches!; The real problem is the dumbing down of critical thought in society. With so much false, misleading or plain lying on the internet (and in politics) it is crucial that we provide the youngsters with the necessary skill sets to make informed decisions. The over reliance on anything outside the human brain (as imperfect as it is) is always fraught with risk……………………………….; It already is. This article is like 5-10 years overdue; No shit. Didn't take much research for that.; … soon? 😂 Mr Guardian are you implying that Algorithms don’t do this already",2024-12-30T02:17:19,fungussa,https://www.theguardian.com/technology/2024/dec/30/ai-tools-may-soon-manipulate-peoples-online-decision-making-say-researchers
