title,content,upvotes,comments_count,top_comments,created,author,url
How can we get involved in the future and make a real difference?,"I’ve wanted to make the world a better place for as long as I can remember, even if the sentiment is held as “naive” in today’s culture. Looking through this sub, I don’t doubt there are others who wish to do so as well.

However, unless you start from a place of privilege, there is no conceptual basis or available resources to start change and make impact from. Is there anything available for us to make real difference in the world of tomorrow? Or at the very least, a starting resource somewhere online?",41,56,"“The purpose of life is to discover your gift. The meaning of life is in giving it away.”

Do what you can to bring light to the lives of others. Do so from somewhere deep inside built on a foundation of passion for YOU. In other words, don't seek to fill the role you think might make the most impact- instead seek what is most impactful to you and radiate out to those waiting to receive it.

Maybe not the kind of answer you were looking for, but I honestly believe that this is the way. You'll start making small positive influences to start, and your efforts will grow in impact over time.; I volunteer as a tutor.

I myself may make an impact as an engineer, and I hope my publication(s) are useful. 

But I know some of the students I helped 7 years ago learn to love math and science have gone onto  greater things. 

We as individuals cannot make great changes. But we as people can. Look for ways to rise your fellow members of humankind in anyway and you will make a difference.; Volunteer, aid work, research subject, prison rehabilitation program; Feed kids. Keep them safe. They are the foundations of the future.; You have to drop the common notion people have nowadays that everything has already been done before and then learn to venture out and try new things; Get to know the people around you, be kind to yourself and others. Get involved in your city and neighborhood. When people see that you’re happy, they’ll want to know why and may start to rethink things themselves.

Also, we spend too much time on the internet and believe everything there is real. But when you actually talk to people, you might realize things aren’t as bad as they seem.; submission statement: 

I’m looking for resources and advice from other like-minded souls on how to make a real impact in the future；can come from books, organizations, or strategies, i’m just tired of hearing about the glorious future and being unable to take direct part in it; You can get a regular job that helps people, Ive always thought the same as you and currently I'm a tree surgeon and most of my job is making trees safe for the public and keep the trees healthy which helps the environment. And when my body gives out in my 40s I'm going to change my career to become a healthy and safety inspector in construction (I went Uni and have a construction degree) so I can continue to help others. Every little help you do is a real difference even if your just down your local nursing home helping th elderly. You don't have to help a billion people, if everyone in the world looked after just 1 or 2 other people apart from themselves then the world would be a much better place.; Reddit is the wrong place to find such an answer. Most of the reddit crowd is pessimistic and lazy. Also, it’s not naive to think you want to make the world a better place. You do not need to come from a place of privilege to make a difference. Look at edhi, dashrat manjhi. They weren’t privileged at all. Attend ngo events, volunteer for everything, talk to people and find out what you want. The road you are taking isn’t easy. Remember not to give up and give it your best. ; This varies greatly from place to place so you're going to have to research your local political structure. The most meaningful way you will ever make change in the future will be through existing political parties and systems established within your local government. And likely the most impact you will be able to have will be at the local level rather than national as often local governments tend to get ignored and overlooked by most people despite them often having the most direct involvement in everybody's day to day life. It will be hard and require working with others and is not going to result in an overnight change which is why most people just don't bother and instead like to just complain about how both sides are bad and nobody can put forward a decent candidate and other bullocks instead.",2024-12-25T07:23:56,Holiday-Song-4211,https://www.reddit.com/r/Futurology/comments/1hlw2nf/how_can_we_get_involved_in_the_future_and_make_a/
"Spain runs out of children: there are 80,000 fewer than in 2023",No Content,19411,2473,"The following submission statement was provided by /u/madrid987:

---

ss: We have been talking about the declining birth rate in Spain for years, and its effects are beginning to be very evident in the census: Spain is running out of child population.

The population under 16 years old has decreased by 3.2% since 2021 whereas the population over 64 has increased by 6.6%. and 18.2% of the Spanish population was born outside of Spain

reality, In the parks of many neighborhoods and cities in Spain, it is becoming increasingly common to see more dogs than children playing

As a result of this evolution, the relative weight of the population over 64 years old now exceeds 20%, while those under 16 years old represent 14%, confirming the progressive aging of the Spanish society.

---

 Please reply to OP's comment here: https://old.reddit.com/r/Futurology/comments/1hluqtr/spain_runs_out_of_children_there_are_80000_fewer/m3p8r6b/; That’s why you always pick up a few extra at the store even if you’re not hungry right then; Goodness, here we all worried about resources as the population explodes and pollution, but in reality capitalism has solved this problem by making everything so expensive that no one can have kids or a house while not paying anyone a livable wage! Overpopulation problem solved.; Countries complaining about declining birth rates need to incentive having children through actual policy change. Plenty of people want to have kids, but they literally don't have the ability to raise that child effectively because they're being forced to work two or even three jobs just to survive. 

Where I live, the average rent is $1700 a month. Most people I know make ~minimum wage, which is just over $16 an hour for my state. And we're supposed to be having kids? How the fuck are we supposed to do that?

Edit: holy fuck what; Who'd want to have kids when barely making 1000€/month? When they pay reasonable salaries in Spain the birth rate will rise; Why do articles always seem to talk about birth rates like they are quarterly profit margins?; Hard to have kids if you live in a one-bedroom apartment and commute for two hours per day.; So what with AI and automation there’s less jobs available anyways

Sure the billionaire want an endless supply or workers because they don’t really care if they survive or not so long as there’s enough desperate people to cater to their needs; This is a new kind of click bait , where the sensational title unravels within the title itself rather than on the article content,  “Spain runs out of children”….. not really, just “fewer” children than last year, all within the title.

I think I much prefer it this way, it saves you from having to actually click to find out it is BS.; And what are they doing to help women who chose to have children?",2024-12-25T05:44:00,madrid987,https://www.lavanguardia.com/mediterranean/20241219/10223824/spain-runs-out-children-fewer-2023-population-demography-16-census.html
Uncertainty leads to Infinity,"I’ve always wondered about the delicate balance between complexity and simplicity in everything around us.

Is the world simple because we found something that worked and stopped exploring? Or is it complex because we never dared to uncover the deeper truths behind the systems that no longer serve us?

Every question leads to an answer, and every answer opens the door to more questions—a cycle so vast it feels like we’ve barely scratched the surface. There’s so much room for expansion, yet we remain tethered to the norms we’ve created.

But what if humanity could break free from that? What if we looked beyond everything we know now and focused singularly on infinite discovery?

Imagine a future of new ventures, new math, and new physics. A future not just of innovation to make life easier, but the next stage of evolution—continuous evolution.

The fate of such a world wouldn’t rest in the hands of a few but in all of us, together, hand in hand. Could we ever unite in pursuit of the infinite potential this life holds?

To run toward uncertainty is to build the possibility of a world we’ve never even conceived of.

If we were immortal—not in body, but in the sense that our souls burned eternally with the passion for discovery—what would we be capable of?

Perhaps accepting that we don’t truly know anything is the first step. That very acceptance could spark a momentum so profound it inspires a world built on wonder, curiosity, and exploration.

So, I ask you: What could we create if we embraced the unknown? What would that world look like? Would it be ugly, or would it be blissful?",0,28,"This doesn't seem like the right place to ask such a question. This is barely a question. It is more akin to an observation regarding your own perception of how questions about knowledge are pursued. Epistemology is very consistent in reinforcing your own idea that uncertainty is a basis for new understanding, but you challenge that this isn't done to your satisfaction? 


There are fundamental principles of how logic is structured to consistently approach questions about the world around us, but these fundamentals are also subject to criticism and change. This very process is how the scientific method and similar tools have become so robust. They are the result of the very process you propose, not because of dogmatic rigidity. There was a Renaissance, remember? Would you toss these tools aside just because they CAN be discarded?

Perhaps you should dwell on the implications of your own question. Instead of considering aesthetics, consider purpose and consequence.; “Could we ever unite in pursuit of the infinite potential [that] this life [could] hold?” Yes, this must happen if our species wants to survive.; Intriguing proposition.  Wouldn’t it make more sense that certainty actually leads to infinity?; In my experience uncertainty leads to more wrong actions.  The more certain you are the less number of tries it takes.


You could say the wisdom of ""Do or do not there is no try."" could be interpreted as ""Be certain and you will spend less energy.""",2024-12-25T02:51:36,50K_Icey,https://www.reddit.com/r/Futurology/comments/1hlsaix/uncertainty_leads_to_infinity/
Future Cars Worth Waiting For: 2025–2028,No Content,0,19,"The following submission statement was provided by /u/Low-Supermarket8226:

---

It’s always exciting to see how technologies are being integrated into our daily lives. I’m particularly intrigued by the rise of autonomous systems and the potential of vehicles to become more like smart mobility hubs...and the integration of AI could transform how we interact with our vehicles, and I think we're just scratching the surface. It's definitely an exciting time to be involved in the automotive industry. Do you think smart cars will be mainstream by the end of the decade?

---

 Please reply to OP's comment here: https://old.reddit.com/r/Futurology/comments/1hlaa9r/future_cars_worth_waiting_for_20252028/m3kn2pf/; [deleted]; I just don't see cars as an exciting part of the future, especially as more touchscreens and corporate surveillance methods are added. I'm excited about walkability and public transportation 🤷🏾‍♀️; Ah, the new crop of midlife crisis fashion accessory phallic compensators are out. Pleased to see they've gone for the traditional gay spaceship / face of robot fish aesthetic.

Just put some wheels on an aerodynamic box, you fanny.

All of the time and effort spent sticking swoopy shapes of plastic crap on it could have been better spent making it more mechnically capable or comfortable.

The pixelated headlights did give me a lol though. Do they animate so it can wink at other emotional support vehicles as you pass?; The vehicle I'm waiting for is the Alpha Wolf Pickup RWD model (aka: Single Motor Base Model).

EV Pickup with old school Toyota Pickup vibes  
[https://www.alphamotorinc.com/wolfrwd](https://www.alphamotorinc.com/wolfrwd)

Unfortunately, I believe the company mostly just produces renders of vehicles. However, they did make a prototype of the pickup truck.  
[https://en.wikipedia.org/wiki/Alpha\_Wolf\_(pickup\_truck)](https://en.wikipedia.org/wiki/Alpha_Wolf_(pickup_truck))

I imagine it will continue to be vaporware. Heck, even if they do actually make a vehicle, it would be scary to buy a first generation vehicle from a newly created automotive company.; Until they have radioactive crystal powered vehicles, I'm not interested.; Buying new shit is for dimwits. Especially New cars.; Most of these cars don't have a timeless design. I can imagine all of them aging within a span of a few years. We can see a similar example in Cyberpunk 2077—some of the cars in the game were produced well before 2077, and they already look outdated, much like these, especially the Rivian R3X.; I wonder why they say the N Vision 74 is still not confirmed? It was in their investor presentation as one of the cars being produced by 2030. I'd know because I about cried when I found out. Previously it was a concept car with no plans to produce it.

Edit: dream ruined. They're only making 100 of them :(; It’s always exciting to see how technologies are being integrated into our daily lives. I’m particularly intrigued by the rise of autonomous systems and the potential of vehicles to become more like smart mobility hubs...and the integration of AI could transform how we interact with our vehicles, and I think we're just scratching the surface. It's definitely an exciting time to be involved in the automotive industry. Do you think smart cars will be mainstream by the end of the decade?",2024-12-24T09:43:50,Low-Supermarket8226,https://www.roadandtrack.com/rankings/g43854161/future-cars/
EU Commission to Build First Net-Zero Emissions Building in Spain,No Content,77,6,"The following submission statement was provided by /u/madrid987:

---

ss: The European Commission’s Joint Research Centre in Seville will house the EU’s first net-zero emissions building. Project emphasizes sustainability, innovation, and local materials.

The project exemplifies the principles of the New European Bauhaus, combining innovation and environmental responsibility. The building will feature a dome-shaped roof made of solar panels to generate energy exceeding its operational needs. This setup ensures the building achieves net-zero emissions, including offsetting the carbon footprint of its construction.

---

 Please reply to OP's comment here: https://old.reddit.com/r/Futurology/comments/1hl5rvm/eu_commission_to_build_first_netzero_emissions/m3jr5ve/; ss: The European Commission’s Joint Research Centre in Seville will house the EU’s first net-zero emissions building. Project emphasizes sustainability, innovation, and local materials.

The project exemplifies the principles of the New European Bauhaus, combining innovation and environmental responsibility. The building will feature a dome-shaped roof made of solar panels to generate energy exceeding its operational needs. This setup ensures the building achieves net-zero emissions, including offsetting the carbon footprint of its construction.; Lol net zero for what?
It is still big glass and concrete brick. Just with fancy document label.
I wonder if they are gona run it without AC and only in daylight hours. Because those solar panels do not seem to be enough. And will they add mining batteries to this net zero project",2024-12-24T04:30:23,madrid987,https://esgnews.com/eu-commission-to-build-first-net-zero-emissions-building-in-spain/
The future of ai is decentralized systems ,I create and share these storm articles to spread the knowledge needed for people to contribute to these systems that are needed for the future of a fair and equitable society.,11,4,"The following submission statement was provided by /u/eqai_inc:

---

I the world is in great neeed of a network like this I really hope there are enough people to see the train coming.

---

 Please reply to OP's comment here: https://old.reddit.com/r/Futurology/comments/1hkf4qp/the_future_of_ai_is_decentralized_systems/m3e1znz/; I the world is in great neeed of a network like this I really hope there are enough people to see the train coming.; i skimmed the article, no time to fully soak it in right now. However I'll just point out that this claim makes sense, engineering 101 is to implement redundancy everywhere all the time. Makes a better quality and more likely to survive system. 

Step 1 is make it work period, and when its super new and super expensive thats almost always more centralized because of many reasons. 

Step 2 is make it more efficient

Step 3 is make it more robust

Step 4 ???

Step 5 Profit. 

Okay 4 and 5 I added for luulz. But you get the idea :)",2024-12-23T03:34:40,eqai_inc,https://storm.genie.stanford.edu/article/building-a-decentralized-ai-system-utilizing-federated-learning--412561
The future of drone warfare,"I just had a thought, being a sci-fi nerd, that the evolution of drone warfare we’re seeing in Ukraine uncannilly parallels the evolution of missile battles between spacecraft in David Weber’s Honor Harrington series. In the books, early battles started with a few missiles, then escalated to more and more massive salvos with decoys, electronic warfare to confuse defenses, energy weapons, missile pods, and continuously evolving layered defenses to try to counter it all. 

So, if we use the book series as a playbook framework for what we are likely to see, what are we looking at in the coming months and years?  Thinking mostly about aerial drones (and ballistic and hypersonic missiles) with payloads, and with a bias towards the actions of Ukraine as the defender.

**Better electronic warfare (EW):** Tools to jam or mislead drones so they crash or return home. [Check](https://www.newsweek.com/ukraine-russia-drones-belarus-spoofing-gps-1992969)

**Layered defenses:** Combining lasers, missiles, projectile weapons, manned planes, and counter-drones for overlapping layers of coverage. [Check.  And Ukraine just announced its deployment of its Tryzub laser weapons](https://www.reuters.com/world/europe/ukraine-says-it-has-laser-weapon-able-down-targets-flying-over-2km-2024-12-16/).

**AI for smarter targeting:** Quickly identifying real threats and ignoring decoys.  

**Autonomous counter-drones:** Small drones to chase and destroy enemy drones.  Could be adding automation and AI.

**More directed-energy weapons:** Like lasers and microwaves to disable drones without contact.

**Preemptive strikes:,* Targeting drone launchers and supply chains before attacks start. (Check - bomber bases, drone factories, drone launch sites)

**Cheaper defenses:** Cost-effective options like low-power lasers or kinetic tools like nets.

**More Civilian protection:** Defenses for cities, power plants, and airports, as more defense becomes available for targets beyond military sites.

Who knows how fast techology will progress... but all of this made sense to me as I thought it through, and I recall that scifi authors have often been consulted as futurists in the past as they have thought deeply about things that others haven't.  

Posting this to r/Futurology as it felt more Futurist-y than sci-fi-y, but will post this over there as well.  Hopefully I won't have inadvertently broken some rule.  :)",49,12,"Onboard ai means the drones can’t be jammed. EW might be totally useless in future; Look for the YouTube short ""slaughterbots"" for a plausible (but frankly terrifying) possible future for drones.; They will go smaller as well. Smaller, lighter, faster until you have thousands of murder rats swarming, swimming and flying. 

Devices the size of a grapefruit that will hide, chase, climb...explode.; I’m to lazy to find them but I’m pretty sure you can find examples of all of those things you mention already in use; Just wait till there are ""drones"" that blanket the sky  making you think some kind of mass attack is happening but they aren't actually  anything at all. Or "" drones"" that affects the reality the viewer experiences.  We haven't seen anything yet....",2024-12-23T20:34:57,crab_races,https://www.reddit.com/r/Futurology/comments/1hkwrh1/the_future_of_drone_warfare/
Ukraine’s All-Robot Assault Force Just Won Its First Battle - That Ukraine even needs so many unmanned weapons points to a deep manpower shortage.,No Content,1012,234,"The following submission statement was provided by /u/Gari_305:

---

From the article

>It was an impressive technological feat—and a worrying sign of weakness on the part of overstretched Ukrainian forces. Unmanned ground vehicles in particular suffer profound limitations, and still can’t fully replace human infantry.

>That the 13th National Guard Brigade even needed to replace all of the human beings in a ground assault speaks to how few people the brigade has compared to the Russian units it’s fighting. The 13th National Guard Brigade defends a five-mile stretch of the front line around the town of Hlyboke, just south of the Ukraine-Russia border. It’s holding back a force of no fewer than four Russian regiments.

---

 Please reply to OP's comment here: https://old.reddit.com/r/Futurology/comments/1hkr5fq/ukraines_allrobot_assault_force_just_won_its/m3gdkn3/; So ukraine wins a battle with no human casualties, and they spin it as a weakness? Manpower  issues are not a secret. They have been using tech since the beginning to give an edge to their soldiers. 

Iirc, they held a bridge with two remote-controlled MG emplacments. They only had to run in and out to reload the ammo.; This war became a huge advertisement about unmanned stuff.; # ""That Ukraine even needs so many unmanned weapons points to a deep manpower shortage.""

Or they don't think their people are disposable, and would rather risk drones than people's lives.

spin spin spin; Ukraine's use of gunpowder weaponry points to a deep swordsman shortage.; This is a deliberately negative take.
Let's do the same with M1 Abrahams tanks :- .""Ukraine deploys US tanks that prioritise crew protection over manoeuvrability is a worrying example of Ukraine's manpower shortages.
The equivalent deployment by Russia of 30 year old Russian tanks that are slower, less well protected and have outdated fire control clearly illustrates that Russia has unlimited manpower to waste unnecessarily and therfore are better and will win. ""
Call themselves journalists.; Weird take. I've been hearing/reading from multiple sources that we are quickly approaching a state where the front line is simply too dangerous for humans. Drones are everywhere and there's going to be more of this on both sides. I wouldnt chalk it up as a weakness; Well guys that's it...

We now officially have the War Robots game in real life.
What fantastic and peaceful times are about to begin. 
Truly excited for humanities future /s; If you’ve seen civdiv’s videos you’d know that pretty much nothing can exist on the Ukraine/Russia border without getting destroyed.

*Both sides* are using drones to account for that problem.; 'Deep shortage of manpower' is a weird way to say 'revolutionary life-saving military tech'",2024-12-23T16:16:53,Gari_305,https://www.forbes.com/sites/davidaxe/2024/12/21/ukraines-first-all-robot-assault-force-just-won-its-first-battle/
