title,content,upvotes,comments_count,top_comments,created,author,url
NASA’s micro-mission Lunar Trailblazer will make macro-measurements of the lunar surface in 2025,No Content,1,2,"The following submission statement was provided by /u/Gari_305:

---

From the article

>[PRIME-1](https://www.nasa.gov/mission/polar-resources-ice-mining-experiment-1-prime-1/), or the Polar Resources Ice Mining Experiment, will be mounted on a lunar lander. It’s scheduled for launch in January 2025.

>Aboard the lander are two instruments: [The Regolith and Ice Drill for Exploring New Terrain](https://nssdc.gsfc.nasa.gov/nmc/experiment/display.action?id=PRIME-1++-01), TRIDENT, and the [Mass Spectrometer for Observing Lunar Operations](https://nssdc.gsfc.nasa.gov/nmc/experiment/display.action?id=PRIME-1++-02), MSOLO. TRIDENT will dig down up to 3 feet (1 meter) and extract samples of lunar soil, and MSOLO will evaluate the soil’s chemical composition and water content.

>Joining the lunar mining experiment is Lunar Trailblazer, a satellite launching on the same [Falcon 9 rocket](https://www.spacex.com/vehicles/falcon-9/).

---

 Please reply to OP's comment here: https://old.reddit.com/r/Futurology/comments/1hpt3kv/nasas_micromission_lunar_trailblazer_will_make/m4k1gej/; From the article

>[PRIME-1](https://www.nasa.gov/mission/polar-resources-ice-mining-experiment-1-prime-1/), or the Polar Resources Ice Mining Experiment, will be mounted on a lunar lander. It’s scheduled for launch in January 2025.

>Aboard the lander are two instruments: [The Regolith and Ice Drill for Exploring New Terrain](https://nssdc.gsfc.nasa.gov/nmc/experiment/display.action?id=PRIME-1++-01), TRIDENT, and the [Mass Spectrometer for Observing Lunar Operations](https://nssdc.gsfc.nasa.gov/nmc/experiment/display.action?id=PRIME-1++-02), MSOLO. TRIDENT will dig down up to 3 feet (1 meter) and extract samples of lunar soil, and MSOLO will evaluate the soil’s chemical composition and water content.

>Joining the lunar mining experiment is Lunar Trailblazer, a satellite launching on the same [Falcon 9 rocket](https://www.spacex.com/vehicles/falcon-9/).",2024-12-30T17:58:30,Gari_305,https://theconversation.com/nasas-micro-mission-lunar-trailblazer-will-make-macro-measurements-of-the-lunar-surface-in-2025-244020
"In a first, surgical robots learned tasks by watching videos - Robots have been trained to perform surgical tasks with the skill of human doctors, even learning to correct their own mistakes during surgeries.",No Content,54,6,"The following submission statement was provided by /u/Gari_305:

---

From the article

>Now, a team of Johns Hopkins University and Stanford University researchers has reported a significant advance, training robots with videos to perform surgical tasks with the skill of human doctors.

>The robots learned to manipulate needles, tie knots and suture wounds on their own. Moreover, the trained robots went beyond mere imitation, correcting their own slip-ups without being told ― for example, picking up a dropped needle. Scientists have already begun the next stage of work: combining all of the different skills in full surgeries performed on animal cadavers.

>A new generation of more autonomous robots holds the potential to help address a serious shortage of surgeons in the United States, the researchers said.

>Presented at the recent Conference on Robot Learning in Munich, the research comes almost four decades after the PUMA 560 became the first robot to assist in the operating room, helping with a brain biopsy in 1985.

>The new work is currently undergoing review for publication in a journal. And the next-generation surgical robots will need to demonstrate safety and effectiveness in clinical trials, and receive approval from the Food and Drug Administration before they can become a fixture in hospitals.

---

 Please reply to OP's comment here: https://old.reddit.com/r/Futurology/comments/1hpssrb/in_a_first_surgical_robots_learned_tasks_by/m4jyx34/; Yeah can't wait for the robot to accidentially perform an oil change instead of a tumor removal because someone forgot to the delete the video from the training data. /s; From the article

>Now, a team of Johns Hopkins University and Stanford University researchers has reported a significant advance, training robots with videos to perform surgical tasks with the skill of human doctors.

>The robots learned to manipulate needles, tie knots and suture wounds on their own. Moreover, the trained robots went beyond mere imitation, correcting their own slip-ups without being told ― for example, picking up a dropped needle. Scientists have already begun the next stage of work: combining all of the different skills in full surgeries performed on animal cadavers.

>A new generation of more autonomous robots holds the potential to help address a serious shortage of surgeons in the United States, the researchers said.

>Presented at the recent Conference on Robot Learning in Munich, the research comes almost four decades after the PUMA 560 became the first robot to assist in the operating room, helping with a brain biopsy in 1985.

>The new work is currently undergoing review for publication in a journal. And the next-generation surgical robots will need to demonstrate safety and effectiveness in clinical trials, and receive approval from the Food and Drug Administration before they can become a fixture in hospitals.",2024-12-30T17:45:26,Gari_305,https://www.washingtonpost.com/science/2024/12/22/robots-learn-surgical-tasks/
Has the Rate of Technological Advancement Slowed Down?,"First off, I’m asking this because I want somebody to convince me otherwise. I think there’s a lot of potential technologies that seem really exciting, I just have some skepticism about whether they’re coming anytime soon. 

I’m mainly concerned that it seems like over the past hundred or so years, our day-to-day life has changed dramatically, but probably more so from say 1920-1970 than 1970-2020, and maybe a lot more so between say 2000-2010 than 2010-2020. Is there a wall of technology that we’ll eventually hit, and are we starting to bump up against it (either physical limit Moore’s Law type stuff or just needing exponentially more money and people)? Is there new reason to believe that things like fusion, quantum computing, or major longevity advances are coming soon? Is there any new reason to not be so skeptical about the way AI is being trained limiting its usefulness to basically what it can do now? I’ve seen some of the news, but I don’t know enough to know how big each step for these are in the grand scheme of things.

Again, I’m not trying to be a naysayer, I just want to be convinced. Sorry if this is overly long or a common topic, I’m just curious.",0,69,"I honestly think it is accelerating, and we've just become accustomed to things changing so much and so quickly that we have just learned to tune it out. For example, we have learned more about our universe in the last 35 years, between Hubble and Webb, than we have in the history of mankind before that.

Artificial intelligence has taken off in ways that were science fiction just a generation ago (I'm in my 50's, and my first AI was called Eliza... look it up some time :)).

At the same time, I think the utility may have decreased. Quite honestly the biggest technological advancements in terms of helping mankind were things like indoor plumbing, germ theory, antibiotics and a national road service. Those each had a dramatic impact on our welfare while things like AI won't have nearly the same impact as say, not dying from a simple cut that gets infected.; We have recently gotten a new type of vaccine with mRNA and a crazy anti obesity drug with Ozempic. 


Smartphones are crazy and only a development of the last 10-15 years.


Augmented reality is slowly finding its spot. 


Modern language models allow us to talk to our computers like in star trek.


Machine learning can recognize some sorts of cancer better than any doctor. And there is way more ML can do, but you probably never heard of it as it is mostly trained for specific tasks.


Fusion power is actually making steps recently.


Big data approaches allow as to understand genetics way better than before.


And a lot of those things are only possible due to better computation in the traditional way. Currently quantum computing is in a similar state as traditional computers were 100 years ago, expensive experiments. Once we get them to a usability like modern computers who know what possibilities will open up. But I am very certain it won't take 100 years.; I think tech advancement has been increasing exponentially. I'm talking all fields, not just computing. Medicine, agriculture, manufacturing, etc. Everything has seen huge improvements in the last 20 years, crazy fast progress that was never seen before. The information age has come and grown way faster than any other age imo.; You're asking strangers from all parts of the planet this question and getting answers in real time on a device that fits in your pocket,  uses no wires for power or to communicate, and can access more information than has existed in all of previous history in seconds.; Depends.  In 1841, it took 110 days for news of President Harrison’s death to reach Los Angeles.  In 1861, such news might take an hour to get there, all things considered.  A speedup of 2,640 times over twenty years.

That growth is “faster than Moore’s law,” to use an oversimplified definition of the law.

In some ways, one could say progress has slowed down over the last 160 years.; Probably yes. It’s really about engineering now. To advance engineering requires innovation, and that innovation demands significant investment with no guaranteed profit. In today’s world, everything has become much more profit-driven. As an engineer, I believe this focus on profit has stifled innovation to some extent.

The virtual world, while generating a lot of money, isn’t offering much in terms of groundbreaking innovation. The emphasis on quick returns and profitability has shifted resources away from long-term, high-risk engineering projects that could lead to significant advancements. Simply, companies are less willing to invest in projects that don’t promise immediate financial returns.

In summary, while there are still advancements being made, the current economic environment prioritizes immediate profit over innovation, which can slow the overall rate of technological progress.; IMHO, the majority of what we see in tech is iterative instead of innovative.  Evolution vs revolution.

Even things we feel were revolutionary are often just iterations on an existing thing. Made better perhaps, with new uses which absolutely can be game changing, but at their core were not a ground breaking innovative thing.

The iPhone wasn’t the first phone with applications on it - although I have heard folks say Apple invented apps on a phone. They didn’t, really. And it certainly wasn’t the first mobile phone. It did have a profound impact on the industry, but that’s mainly because Apple beat others to market, and they’re Apple.

These days I do feel we are at the end of any innovation on mobile phones. Have been for a while actually. It’s a few feature enhancements here and there, but that’s about it. Nothing truly substantial, even if the new ones are “better” than the previous.

AI isn’t even all that innovative. We’ve been playing with it for a long time now. But the amount of effort now spent, along with advances in chip tech to make training of models so much better, we see leaps in its application and reach. But again it’s all evolution / iteration.; I think you need to separate technological development from its application within society. Technology is changing rapidly across a wide variety of economic sectors, but much of the application of that technology is hidden from people outside those industries. 

This happens for a variety of reasons. Something that you don't need in your home won't be in your home. Something you can't afford won't be in your home. Something that's too hard for most people to understand might be in your home but hidden or oversimplified by marketing. 

Just look at social media. It hasn't just been a progression from text to images to video. MySpace and Friendster were entirely driven by deliberate, manual interactions by the user. Today, the feeds are run by invisible algorithms that effectively read your mind, balancing the goals of keeping you engaged and selling you stuff. That's an enormous amount of technology that we don't even think about most of the time because it keeps us entertained and dissociated.; We're improving on a much smaller scale, and the big items you list are things people have been working on for decades at this point, and will continue to do so. As mentioned in the comments, a more cynical view is that most are just looking to earn big. Please shareholders, and just keep some form of status quo. 

I was always convinced that under pressure by a looming threat, humanity will figure out how to solve it. How to do it better, faster, stronger - or just plain outside the box thinking. Sadly, the first real effects of climate change the past few years has done nothing to wake anyone up. No, we're spending a shitton of resources on predictive language models that snake oil salesmen are touting as ""the future"".

Oh well.; Technological advancement hasn’t slowed down, but its direction is increasingly shaped by profit motives and legal barriers like patents and copyright. While these systems incentivize innovation by protecting intellectual property, they also hinder progress by restricting access to foundational technologies. Patents can create monopolies and stifle competition, while restrictive copyright laws limit collaboration, particularly in fields like software and biotechnology. This legal framework often prioritizes corporate interests over the collective advancement of society.

Corporate research and development focuses primarily on profitable areas, such as AI, consumer electronics, and renewable energy, while less lucrative but critical fields, like rare disease treatments or antibiotic development, are underfunded. As a result, innovation tends to favor incremental improvements in marketable products rather than groundbreaking advancements. To truly accelerate progress, we need to address these systemic issues and create incentives that prioritize innovation for societal benefit, not just shareholder profits.",2024-12-30T14:58:33,ReinvigoratedSlouch,https://www.reddit.com/r/Futurology/comments/1hpoz06/has_the_rate_of_technological_advancement_slowed/
"America's declining birth rates are a good thing, but in the meantime we suffer","It was about a year ago now, YouTube channels and news feeds were full of panic concerning human replacement levels. Because our society is a Ponzi scheme that relies on the older folks parasitizing the young, there was sudden and shocked panic when a Bill Gates-funded population study came back with news about low birth rates in the West. Not considering for a second that the world can hardly sustain 8 billion large animals with a taste for meat and territory, makers of content put forth this non-crisis into the world, subtly urging the public to plop out screaming, slimy babies every year. 
This is simply false. A small, few corporations own the entire news media. They write the same stories, support the same politicians (the exception being corporate simps at Fox News) while influencing and manipulating your thoughts. They own everything and what they say goes. 

I have recently been flooded by useful idiocy manifesting itself in the form of regular people simping for corporate, semi-State-funded, developers, with nothing to gain other than Soviet style apartments in a phony, sterilized and manufactured neighborhood. 

Low human populations are great for wildlife, mental health, intentional lifestyles, conservation, resource areas, rents, mortgages, and high quality family time

Developers are not your friend, neither is the government. They're sneaky. Be careful about what you think you believe. Our population is still far above what it should be. We still have too many people.
. .",0,28,"> Because our society is a Ponzi scheme that relies on the older folks parasitizing the young


Stopped reading right there; Yes, our population is too high, but birth rates well below replacement levels means masses of old people dying alone and without care. It means the collapse of public health systems and pension schemes. 

It's means extremely old societies, which is not only awful for old and sick people, but also for young people who have to live in them, and either have to (1) devote their lives to support the old or (2) do away with democracy (because the old will be a large majority and won't vote for society letting them die drowning in their own shit) and let them die without care.

Either way, not a pleasant way to live for anybody.

We'll see, but it seems to me that a birth rate slightly below replacement would be a slower but much more pleasant way to decrease population.; >Low human populations are great for wildlife, mental health, intentional lifestyles, conservation, resource areas, rents, mortgages, and high quality family time

Is there any place where humans are just loving life and flourishing while at the same time being low in numbers? (Note: It cannot be some group that is living off another larger group).

Also, there are always negatives and positives with something. You listed what you think would be positives... so what would the negatives be?; > Because our society is a Ponzi scheme that relies on the older folks parasitizing the young,

Proof?; Low birth-rates isn't about population numbers and free space for animals. Low-birthrates are a litmus test for greater social and economic problems none of which are good for people *or* the planet. On paper the planet can definitely benefit from a reduction of human-caused problems (including population) across the board but blindly claiming a reduction in birthrates is a good thing because *""people = bad""* is the equivalent of holding the cardboard sign of *""THE END IS NEAR""* on a street corner.; While I don’t really share your insanity, I’ve told my kids many times they are the first generation of people that will willingly have children that will have worse futures than their parents.

And they should think long and hard before deciding to have kids because those kids will suffer. But not nearly as much as their kids. 

Gos help us all in 50-100 years.; I don't see why people are freaking out. The job market is smaller, AI is taking, and will continue to take jobs, and Robotics will take whatever's left in 1-2 decades, and by that time I expect AI to sentient. We will soon be obsolete.; Low birthrates might be good for the planet, but it's not for the sustainability of nation states.; There’s worldwide declining birthrates except for 4-5 countries and I’ll say it’s social media.  Younger people look at the pictures of the rich and famous living it up, and there’s probably a thought that “I can’t have it all” .. so human nature is set up to grab the most immediate rewards (eating at good restaurants, more exotic travel, etc..).  

Part is envy which, in about every religious system, is considered a “sin”.  Yet now instead of being read, the tantalization is right in front of everyone and marketing depends on the emotion “get it now”.  

Vs. as mega-investor Warren Buffett pointed out, … his television, modest car, modest Omaha house, and modest “diet” (he’s made up of McDonald’s and Coca-Cola in his 90s) is really no different than most comfortable middle class (maybe slightly ahead) people .. albeit with a security detail (probably a business deduction in the US). 

tl:dr; to reverse this, governments would probably need to get rid of internet access and restrict advertising/marketing, “influencer” type internet posts, etc..; >Not considering for a second that the world can hardly sustain 8 billion large animals with a taste for meat and territory

World could sustain multiple times that amount with proper land and agricultural management. 

>Low human populations are great for wildlife, mental health, intentional lifestyles, conservation, resource areas, rents, mortgages, and high quality family time

This is only good if tech/AI ends up automating vast amounts of drudgery. A stagnant or declining population isn't horrible. Look at Japan and South Korea. Their populations are declining, but they are still great places to live, and visit. The danger imo is that if we don't accept declining population, but instead use mass immigration to continue to have population growth even when existing population is below replacement fertility levels. This means entire nature of the country (any country undergoing this) would change. Also means that if the underlying cultural issues aren't fixed, those immigrants and their children will also than have lower fertility, thus necessitating the need for more immigrants ad infinitum. 

Anyway, a declining population is generally bad or at least not good for economic growth, but aside from that it's not inherently a bad thing",2024-12-30T07:44:44,Terrifying_World,https://www.reddit.com/r/Futurology/comments/1hpi5ja/americas_declining_birth_rates_are_a_good_thing/
Facebook Planning to Flood Platform with AI-Powered Users,No Content,1136,302,"The following submission statement was provided by /u/katxwoods:

---

Submission statement: Meta says that it will be aiming to have Facebook filled with AI-generated characters to drive up engagement on its platform, as part of its broader rollout of AI products, the Financial Times reports. The AI characters will be created by users through Meta's AI studio, with the idea being that you can interact with them almost like you would with a real human on the website.

""We expect these AIs to actually, over time, exist on our platforms, kind of in the same way that accounts do,"" Meta vice-president of product for generative AI Connor Hayes told the FT.

""They'll have bios and profile pictures and be able to generate and share content powered by AI on the platform... that's where we see all of this going,"" he added.

---

 Please reply to OP's comment here: https://old.reddit.com/r/Futurology/comments/1hpf9v0/facebook_planning_to_flood_platform_with/m4h5ds3/; Translation: “Our real users are quitting the platform, so we will fill our community with fake users instead.”; Submission statement: Meta says that it will be aiming to have Facebook filled with AI-generated characters to drive up engagement on its platform, as part of its broader rollout of AI products, the Financial Times reports. The AI characters will be created by users through Meta's AI studio, with the idea being that you can interact with them almost like you would with a real human on the website.

""We expect these AIs to actually, over time, exist on our platforms, kind of in the same way that accounts do,"" Meta vice-president of product for generative AI Connor Hayes told the FT.

""They'll have bios and profile pictures and be able to generate and share content powered by AI on the platform... that's where we see all of this going,"" he added.; So just better bots then they already have? This seems like a good way to both fake engagement for more ad dollars and to drive away sane people from social media.; Huh LMFAO, engagement. How about giving me the people I follow and am friends with in my feed instead of 90% ads and spam. How about showing the latest updates instead of my friend posting about shit 20 days ago.; Planning feels like an understatement. Its going full swing already from my point of view. I'm constantly being bombarded by clearly AI photos that keep pushing hardline political topics on both sides. I constantly block these pages and tell my feed to not show content like that and yet it only increases.; Why would advertisers pay for engagement from fake users...?; Thanks Zuck, I needed another reason to finally quit the platform; Well, that's the death of Facebook.  

We need AI agents that proactively snooze and block Facebook pages.; Internet is such a garbage place now. Give me the early 2000s all over again",2024-12-30T04:44:10,katxwoods,https://futurism.com/the-byte/facebook-planning-ai-powered-usersn
